{
  "nodes": [
    {
      "id": "idle",
      "label": "IDLE",
      "position": {
        "x": 10,
        "y": 6
      },
      "type": "node"
    },
    {
      "id": "fetch",
      "label": "FETCH",
      "position": {
        "x": 30,
        "y": 4
      },
      "type": "node"
    },
    {
      "id": "compile",
      "label": "COMPILE",
      "position": {
        "x": 50,
        "y": 4
      },
      "type": "node"
    },
    {
      "id": "test",
      "label": "TEST",
      "position": {
        "x": 70,
        "y": 4
      },
      "type": "node"
    },
    {
      "id": "deploy",
      "label": "DEPLOY",
      "position": {
        "x": 90,
        "y": 6
      },
      "type": "node"
    },
    {
      "id": "error",
      "label": "ERROR",
      "position": {
        "x": 50,
        "y": 14
      },
      "type": "node"
    },
    {
      "id": "retry",
      "label": "RETRY",
      "position": {
        "x": 30,
        "y": 14
      },
      "type": "node"
    }
  ],
  "edges": [
    {
      "label": "trigger",
      "source": {
        "node": "idle"
      },
      "target": {
        "node": "fetch"
      },
      "id": "idle-fetch",
      "type": "flow"
    },
    {
      "label": "done",
      "source": {
        "node": "fetch"
      },
      "target": {
        "node": "compile"
      },
      "id": "fetch-compile",
      "type": "flow"
    },
    {
      "label": "timeout",
      "source": {
        "node": "fetch"
      },
      "target": {
        "node": "error"
      },
      "id": "fetch-error",
      "type": "flow"
    },
    {
      "label": "done",
      "source": {
        "node": "compile"
      },
      "target": {
        "node": "test"
      },
      "id": "compile-test",
      "type": "flow"
    },
    {
      "label": "err",
      "source": {
        "node": "compile"
      },
      "target": {
        "node": "error"
      },
      "id": "compile-error",
      "type": "flow"
    },
    {
      "label": "passed",
      "source": {
        "node": "test"
      },
      "target": {
        "node": "deploy"
      },
      "id": "test-deploy",
      "type": "flow"
    },
    {
      "label": "failed",
      "source": {
        "node": "test"
      },
      "target": {
        "node": "error"
      },
      "id": "test-error",
      "type": "flow"
    },
    {
      "label": "diagnose",
      "source": {
        "node": "error"
      },
      "target": {
        "node": "retry"
      },
      "id": "error-retry",
      "type": "flow"
    },
    {
      "label": "reset",
      "source": {
        "node": "retry"
      },
      "target": {
        "node": "fetch"
      },
      "id": "retry-fetch",
      "type": "flow"
    }
  ],
  "schema_version": "diagram.document.v0",
  "id": "state-machine",
  "kind": "state"
}