{
  "nodes": [
    {
      "id": "model",
      "label": "Model",
      "position": {
        "x": 50,
        "y": 2
      },
      "type": "node"
    },
    {
      "id": "embedding",
      "label": "EmbeddingModel",
      "position": {
        "x": 20,
        "y": 10
      },
      "type": "node"
    },
    {
      "id": "chat",
      "label": "ChatModel",
      "position": {
        "x": 50,
        "y": 10
      },
      "type": "node"
    },
    {
      "id": "image",
      "label": "ImageModel",
      "position": {
        "x": 80,
        "y": 10
      },
      "type": "node"
    },
    {
      "id": "tokenizer",
      "label": "Tokenizer",
      "position": {
        "x": 20,
        "y": 18
      },
      "type": "node"
    },
    {
      "id": "adapter",
      "label": "Adapter",
      "position": {
        "x": 50,
        "y": 18
      },
      "type": "node"
    },
    {
      "id": "sampler",
      "label": "Sampler",
      "position": {
        "x": 80,
        "y": 18
      },
      "type": "node"
    },
    {
      "id": "pipeline",
      "label": "Pipeline",
      "position": {
        "x": 50,
        "y": 26
      },
      "type": "node"
    }
  ],
  "edges": [
    {
      "label": "extends",
      "source": {
        "node": "model"
      },
      "target": {
        "node": "embedding"
      },
      "id": "model-embedding",
      "type": "flow"
    },
    {
      "label": "extends",
      "source": {
        "node": "model"
      },
      "target": {
        "node": "chat"
      },
      "id": "model-chat",
      "type": "flow"
    },
    {
      "label": "extends",
      "source": {
        "node": "model"
      },
      "target": {
        "node": "image"
      },
      "id": "model-image",
      "type": "flow"
    },
    {
      "label": "has-a",
      "source": {
        "node": "chat"
      },
      "target": {
        "node": "tokenizer"
      },
      "id": "chat-tokenizer",
      "type": "flow"
    },
    {
      "label": "has-a",
      "source": {
        "node": "chat"
      },
      "target": {
        "node": "adapter"
      },
      "id": "chat-adapter",
      "type": "flow"
    },
    {
      "label": "has-a",
      "source": {
        "node": "chat"
      },
      "target": {
        "node": "sampler"
      },
      "id": "chat-sampler",
      "type": "flow"
    },
    {
      "label": "feeds",
      "source": {
        "node": "tokenizer"
      },
      "target": {
        "node": "pipeline"
      },
      "id": "tokenizer-pipeline",
      "type": "flow"
    },
    {
      "label": "feeds",
      "source": {
        "node": "adapter"
      },
      "target": {
        "node": "pipeline"
      },
      "id": "adapter-pipeline",
      "type": "flow"
    },
    {
      "label": "feeds",
      "source": {
        "node": "sampler"
      },
      "target": {
        "node": "pipeline"
      },
      "id": "sampler-pipeline",
      "type": "flow"
    }
  ],
  "schema_version": "diagram.document.v0",
  "id": "entity-hierarchy",
  "kind": "graph"
}